{
  "$schema": "../schemas/sprinklers.schema.json",
  "schemaVersion": 1,
  "source": "Каталог продукции ЗАО «ПО «Спецавтоматика» 2026 (файл заказчика «Каталог Спецавтоматика Бийск 2026.pdf»; pN — страница PDF, «раздел 1-1-x» — код в подвале страницы)",
  "notes": [
    "K в каталоге — «дм³/(с×10×МПа^0,5)», это K в q = 10·K·√P (q — л/с, P — МПа).",
    "Средняя интенсивность — при высоте установки 2,5 м (если не указано иное), допуск ±5 % по каталогу; защищаемая площадь 12 м².",
    "Номинальные температуры 57/68/79/93/141/182 °C — время срабатывания не более 300/300/330/380/600/600 с.",
    "Все значения перенесены из каталога и не сверены с паспортами (verified: false); таблицы с перепутанными в тексте столбцами сверены по изображениям страниц p12, p24, p31, p37, p64.",
    "K моделей СВН/СВВ-10, -12, -15 (0,35 / 0,47 / 0,77) совпадают с картами орошения П6.4 пособия Мешмана 2002 (p155–p158); эпюры П6.4 не перенесены: скан читается неуверенно."
  ],
  "sprinklers": [
    {
      "id": "sa.svn-10",
      "maker": "ЗАО «ПО «Спецавтоматика» (Бийск)",
      "model": "СВН-10",
      "kind": "sprinkler",
      "medium": "water",
      "purpose": "general",
      "deflector": "down",
      "K": 0.35,
      "K_lpm": 66,
      "orifice_mm": 10.5,
      "tempC": [
        57,
        68,
        79,
        93,
        141,
        182
      ],
      "thread": "R1/2",
      "pMin": 0.05,
      "pMax": 1.0,
      "area_m2": 12,
      "intensity": [
        {
          "P": 0.1,
          "i": 0.07,
          "medium": "water",
          "height_m": 2.5
        },
        {
          "P": 0.3,
          "i": 0.12,
          "medium": "water",
          "height_m": 2.5
        }
      ],
      "rti": "колба Ø3 мм: < 50; колба Ø5 мм: ≥ 80",
      "source": "Каталог продукции ЗАО «ПО «Спецавтоматика» 2026, раздел 1-1-2, p12",
      "verified": false
    },
    {
      "id": "sa.svv-10",
      "maker": "ЗАО «ПО «Спецавтоматика» (Бийск)",
      "model": "СВВ-10",
      "kind": "sprinkler",
      "medium": "water",
      "purpose": "general",
      "deflector": "up",
      "K": 0.35,
      "K_lpm": 66,
      "orifice_mm": 10.5,
      "tempC": [
        57,
        68,
        79,
        93,
        141,
        182
      ],
      "thread": "R1/2",
      "pMin": 0.05,
      "pMax": 1.0,
      "area_m2": 12,
      "intensity": [
        {
          "P": 0.1,
          "i": 0.07,
          "medium": "water",
          "height_m": 2.5
        },
        {
          "P": 0.3,
          "i": 0.12,
          "medium": "water",
          "height_m": 2.5
        }
      ],
      "rti": "колба Ø3 мм: < 50; колба Ø5 мм: ≥ 80",
      "source": "Каталог продукции ЗАО «ПО «Спецавтоматика» 2026, раздел 1-1-2, p12",
      "verified": false
    },
    {
      "id": "sa.svn-k80",
      "maker": "ЗАО «ПО «Спецавтоматика» (Бийск)",
      "model": "СВН-К80",
      "designation": "СВО0-РНо0,42-R1/2/Р57.В3-«СВН-К80»",
      "kind": "sprinkler",
      "medium": "water",
      "purpose": "general",
      "deflector": "down",
      "K": 0.42,
      "K_lpm": 80,
      "orifice_mm": 11.1,
      "tempC": [
        57,
        68,
        79,
        93,
        141,
        182
      ],
      "thread": "R1/2",
      "pMin": 0.05,
      "pMax": 1.0,
      "area_m2": 12,
      "intensity": [
        {
          "P": 0.1,
          "i": 0.078,
          "medium": "water",
          "height_m": 2.5
        },
        {
          "P": 0.3,
          "i": 0.13,
          "medium": "water",
          "height_m": 2.5
        }
      ],
      "rti": "колба Ø3 мм: < 50; колба Ø5 мм: ≥ 80",
      "source": "Каталог продукции ЗАО «ПО «Спецавтоматика» 2026, раздел 1-1-2, p12",
      "verified": false
    },
    {
      "id": "sa.svv-k80",
      "maker": "ЗАО «ПО «Спецавтоматика» (Бийск)",
      "model": "СВВ-К80",
      "designation": "СВО0-РВо0,42-R1/2/Р57.В3-«СВВ-К80»",
      "kind": "sprinkler",
      "medium": "water",
      "purpose": "general",
      "deflector": "up",
      "K": 0.42,
      "K_lpm": 80,
      "orifice_mm": 11.1,
      "tempC": [
        57,
        68,
        79,
        93,
        141,
        182
      ],
      "thread": "R1/2",
      "pMin": 0.05,
      "pMax": 1.0,
      "area_m2": 12,
      "intensity": [
        {
          "P": 0.1,
          "i": 0.078,
          "medium": "water",
          "height_m": 2.5
        },
        {
          "P": 0.3,
          "i": 0.13,
          "medium": "water",
          "height_m": 2.5
        }
      ],
      "rti": "колба Ø3 мм: < 50; колба Ø5 мм: ≥ 80",
      "source": "Каталог продукции ЗАО «ПО «Спецавтоматика» 2026, раздел 1-1-2, p12",
      "verified": false
    },
    {
      "id": "sa.dvn-k80",
      "maker": "ЗАО «ПО «Спецавтоматика» (Бийск)",
      "model": "ДВН-К80",
      "kind": "drencher",
      "medium": "water",
      "purpose": "general",
      "deflector": "down",
      "K": 0.42,
      "K_lpm": 80,
      "orifice_mm": 11.1,
      "thread": "R1/2",
      "pMin": 0.05,
      "pMax": 1.0,
      "area_m2": 12,
      "intensity": [
        {
          "P": 0.1,
          "i": 0.078,
          "medium": "water",
          "height_m": 2.5
        },
        {
          "P": 0.3,
          "i": 0.13,
          "medium": "water",
          "height_m": 2.5
        }
      ],
      "source": "Каталог продукции ЗАО «ПО «Спецавтоматика» 2026, раздел 1-1-2, p12–13",
      "verified": false,
      "note": "интенсивность — как у спринклерного аналога (та же таблица)"
    },
    {
      "id": "sa.dvv-k80",
      "maker": "ЗАО «ПО «Спецавтоматика» (Бийск)",
      "model": "ДВВ-К80",
      "kind": "drencher",
      "medium": "water",
      "purpose": "general",
      "deflector": "up",
      "K": 0.42,
      "K_lpm": 80,
      "orifice_mm": 11.1,
      "thread": "R1/2",
      "pMin": 0.05,
      "pMax": 1.0,
      "area_m2": 12,
      "intensity": [
        {
          "P": 0.1,
          "i": 0.078,
          "medium": "water",
          "height_m": 2.5
        },
        {
          "P": 0.3,
          "i": 0.13,
          "medium": "water",
          "height_m": 2.5
        }
      ],
      "source": "Каталог продукции ЗАО «ПО «Спецавтоматика» 2026, раздел 1-1-2, p12–13",
      "verified": false,
      "note": "интенсивность — как у спринклерного аналога (та же таблица)"
    },
    {
      "id": "sa.svn-12",
      "maker": "ЗАО «ПО «Спецавтоматика» (Бийск)",
      "model": "СВН-12",
      "kind": "sprinkler",
      "medium": "water",
      "purpose": "general",
      "deflector": "down",
      "K": 0.47,
      "K_lpm": 89,
      "orifice_mm": 12.1,
      "tempC": [
        57,
        68,
        79,
        93,
        141,
        182
      ],
      "thread": "R1/2",
      "pMin": 0.05,
      "pMax": 1.0,
      "area_m2": 12,
      "intensity": [
        {
          "P": 0.1,
          "i": 0.09,
          "medium": "water",
          "height_m": 2.5
        },
        {
          "P": 0.3,
          "i": 0.15,
          "medium": "water",
          "height_m": 2.5
        }
      ],
      "rti": "колба Ø3 мм: < 50; колба Ø5 мм: ≥ 80",
      "source": "Каталог продукции ЗАО «ПО «Спецавтоматика» 2026, раздел 1-1-2, p12",
      "verified": false
    },
    {
      "id": "sa.svv-12",
      "maker": "ЗАО «ПО «Спецавтоматика» (Бийск)",
      "model": "СВВ-12",
      "kind": "sprinkler",
      "medium": "water",
      "purpose": "general",
      "deflector": "up",
      "K": 0.47,
      "K_lpm": 89,
      "orifice_mm": 12.1,
      "tempC": [
        57,
        68,
        79,
        93,
        141,
        182
      ],
      "thread": "R1/2",
      "pMin": 0.05,
      "pMax": 1.0,
      "area_m2": 12,
      "intensity": [
        {
          "P": 0.1,
          "i": 0.09,
          "medium": "water",
          "height_m": 2.5
        },
        {
          "P": 0.3,
          "i": 0.15,
          "medium": "water",
          "height_m": 2.5
        }
      ],
      "rti": "колба Ø3 мм: < 50; колба Ø5 мм: ≥ 80",
      "source": "Каталог продукции ЗАО «ПО «Спецавтоматика» 2026, раздел 1-1-2, p12",
      "verified": false
    },
    {
      "id": "sa.svn-k115",
      "maker": "ЗАО «ПО «Спецавтоматика» (Бийск)",
      "model": "СВН-К115",
      "kind": "sprinkler",
      "medium": "water",
      "purpose": "general",
      "deflector": "down",
      "K": 0.6,
      "K_lpm": 115,
      "orifice_mm": 13.3,
      "tempC": [
        57,
        68,
        79,
        93,
        141,
        182
      ],
      "thread": "R1/2",
      "pMin": 0.05,
      "pMax": 1.0,
      "area_m2": 12,
      "intensity": [
        {
          "P": 0.1,
          "i": 0.1,
          "medium": "water",
          "height_m": 2.5
        },
        {
          "P": 0.3,
          "i": 0.165,
          "medium": "water",
          "height_m": 2.5
        }
      ],
      "rti": "колба Ø3 мм: < 50; колба Ø5 мм: ≥ 80",
      "source": "Каталог продукции ЗАО «ПО «Спецавтоматика» 2026, раздел 1-1-2, p12",
      "verified": false
    },
    {
      "id": "sa.svv-k115",
      "maker": "ЗАО «ПО «Спецавтоматика» (Бийск)",
      "model": "СВВ-К115",
      "kind": "sprinkler",
      "medium": "water",
      "purpose": "general",
      "deflector": "up",
      "K": 0.6,
      "K_lpm": 115,
      "orifice_mm": 13.3,
      "tempC": [
        57,
        68,
        79,
        93,
        141,
        182
      ],
      "thread": "R1/2",
      "pMin": 0.05,
      "pMax": 1.0,
      "area_m2": 12,
      "intensity": [
        {
          "P": 0.1,
          "i": 0.1,
          "medium": "water",
          "height_m": 2.5
        },
        {
          "P": 0.3,
          "i": 0.165,
          "medium": "water",
          "height_m": 2.5
        }
      ],
      "rti": "колба Ø3 мм: < 50; колба Ø5 мм: ≥ 80",
      "source": "Каталог продукции ЗАО «ПО «Спецавтоматика» 2026, раздел 1-1-2, p12",
      "verified": false
    },
    {
      "id": "sa.dvn-k115",
      "maker": "ЗАО «ПО «Спецавтоматика» (Бийск)",
      "model": "ДВН-К115",